{
  "url" : "https://github.com/dadoonet/fscrawler/pull/1281",
  "project" : "fscrawler",
  "breakingCommit" : "dde0743630a540bff1ba3033b7016fcfc345122f",
  "prAuthor" : "bot",
  "preCommitAuthor" : "human",
  "breakingCommitAuthor" : "bot",
  "updatedDependency" : {
    "dependencyGroupID" : "org.apache.poi",
    "dependencyArtifactID" : "poi-scratchpad",
    "previousVersion" : "4.1.2",
    "newVersion" : "5.0.0",
    "dependencyScope" : "compile",
    "versionUpdateType" : "major",
    "githubCompareLink" : "A GitHub repository could not be found for the updated dependency.",
    "mavenSourceLinkPre" : "https://repo1.maven.org/maven2/org/apache/poi/poi-scratchpad/4.1.2/poi-scratchpad-4.1.2-sources.jar",
    "mavenSourceLinkBreaking" : "https://repo1.maven.org/maven2/org/apache/poi/poi-scratchpad/5.0.0/poi-scratchpad-5.0.0-sources.jar",
    "updatedFileType" : "JAR"
  },
  "preCommitReproductionCommand" : "docker run ghcr.io/chains-project/breaking-updates:dde0743630a540bff1ba3033b7016fcfc345122f-pre",
  "breakingUpdateReproductionCommand" : "docker run ghcr.io/chains-project/breaking-updates:dde0743630a540bff1ba3033b7016fcfc345122f-breaking",
  "javaVersionUsedForReproduction" : "11",
  "failureCategory" : "TEST_FAILURE"
}