{
  "url" : "https://github.com/jenkinsci/github-oauth-plugin/pull/202",
  "project" : "github-oauth-plugin",
  "breakingCommit" : "99a43573c3ea90d8b942627b8ea947933d229863",
  "prAuthor" : "bot",
  "preCommitAuthor" : "bot",
  "breakingCommitAuthor" : "bot",
  "updatedDependency" : {
    "dependencyGroupID" : "org.jenkins-ci.plugins",
    "dependencyArtifactID" : "github-branch-source",
    "previousVersion" : "2.11.4",
    "newVersion" : "1694.vd46793a_c4a_57",
    "dependencyScope" : "compile",
    "versionUpdateType" : "other",
    "githubCompareLink" : "A GitHub repository could not be found for the updated dependency.",
    "mavenSourceLinkPre" : null,
    "mavenSourceLinkBreaking" : null,
    "updatedFileType" : "JAR"
  },
  "preCommitReproductionCommand" : "docker run ghcr.io/chains-project/breaking-updates:99a43573c3ea90d8b942627b8ea947933d229863-pre",
  "breakingUpdateReproductionCommand" : "docker run ghcr.io/chains-project/breaking-updates:99a43573c3ea90d8b942627b8ea947933d229863-breaking",
  "javaVersionUsedForReproduction" : "11",
  "failureCategory" : "UNKNOWN_FAILURE"
}