{
  "url" : "https://github.com/jenkinsci/code-coverage-api-plugin/pull/645",
  "project" : "code-coverage-api-plugin",
  "breakingCommit" : "06c5386831e97e94d9b9fd155d3ea4aa8711c4e7",
  "prAuthor" : "bot",
  "preCommitAuthor" : "human",
  "breakingCommitAuthor" : "bot",
  "updatedDependency" : {
    "dependencyGroupID" : "org.jenkins-ci",
    "dependencyArtifactID" : "acceptance-test-harness",
    "previousVersion" : "5504.v485694f31cdf",
    "newVersion" : "5541.va_c0a_36b_b_f825",
    "dependencyScope" : "compile",
    "versionUpdateType" : "other",
    "githubCompareLink" : "A GitHub repository could not be found for the updated dependency.",
    "mavenSourceLinkPre" : null,
    "mavenSourceLinkBreaking" : null,
    "updatedFileType" : "JAR"
  },
  "preCommitReproductionCommand" : "docker run ghcr.io/chains-project/breaking-updates:06c5386831e97e94d9b9fd155d3ea4aa8711c4e7-pre",
  "breakingUpdateReproductionCommand" : "docker run ghcr.io/chains-project/breaking-updates:06c5386831e97e94d9b9fd155d3ea4aa8711c4e7-breaking",
  "javaVersionUsedForReproduction" : "11",
  "failureCategory" : "COMPILATION_FAILURE"
}